{
  "id": "owasp.ssrf.a10_url_fetch",
  "title": "Server-Side Request Forgery (SSRF)",
  "description": "Making HTTP requests to URLs derived from user input allows attackers to probe internal network services, cloud metadata endpoints, and bypass firewall controls (OWASP A10:2021 / CWE-918).",
  "policy": {
    "framework": "owasp",
    "category": "ssrf",
    "code": "a10_url_fetch"
  },
  "severity": "high",
  "languages": [
    "*"
  ],
  "tags": [
    "ssrf",
    "owasp-a10"
  ],
  "scope": {
    "node_kinds": [
      "function_call"
    ]
  },
  "match": {
    "any": [
      {
        "fact": "token",
        "op": "matches",
        "value": "(?i)(requests\\.get|requests\\.post|requests\\.put|urllib\\.request|urllib2\\.urlopen|fetch\\(|axios\\.get|axios\\.post|http\\.get|http\\.request).*(?:request|param|input|user|query|url|href)"
      },
      {
        "fact": "token",
        "op": "matches",
        "value": "(?i)(http\\.Get|http\\.Post|ureq::get|reqwest::get|curl_exec).*(?:input|param|user|request|argv)"
      },
      {
        "fact": "layer1_rule_id",
        "op": "equals",
        "value": "L1-SSRF-001"
      }
    ]
  },
  "finding": {
    "message": "Potential SSRF via user-controlled URL at '{{token}}' in {{file}} at line {{line}}.",
    "primary_anchor": "token",
    "related": []
  },
  "mappings": {
    "owasp": [
      "A10"
    ],
    "soc2": [
      "CC6.1"
    ]
  },
  "references": [
    "Validate user-supplied URLs against an allowlist of permitted domains/IP ranges.",
    "Block requests to RFC 1918 addresses (10.x, 172.16-31.x, 192.168.x) and cloud metadata endpoints (169.254.169.254).",
    "Use a dedicated HTTP client library that supports SSRF protection (e.g., SafeCurl).",
    "OWASP SSRF Prevention Cheat Sheet.",
    "CWE references: CWE-918"
  ]
}
