{
  "id": "owasp.access_control.a01_path_traversal",
  "title": "Path Traversal \u2014 Broken Access Control",
  "description": "File paths constructed from user input without canonicalization allow directory traversal attacks, enabling access to files outside the intended scope (OWASP A01:2021 / CWE-22).",
  "policy": {
    "framework": "owasp",
    "category": "access_control",
    "code": "a01_path_traversal"
  },
  "severity": "high",
  "languages": [
    "*"
  ],
  "tags": [
    "path-traversal",
    "access-control",
    "owasp-a01"
  ],
  "scope": {
    "node_kinds": [
      "function_call",
      "string_interpolation"
    ]
  },
  "match": {
    "any": [
      {
        "fact": "token",
        "op": "matches",
        "value": "(?i)(open|read|send_file|include|require|readfile|file_get_contents|readFile|createReadStream).*(?:request|param|input|user|query|argv)"
      },
      {
        "fact": "token",
        "op": "matches",
        "value": "(?i)(os\\.path\\.join|Path\\(|pathlib\\.Path).*(?:request|param|input|user|query)"
      },
      {
        "fact": "token",
        "op": "matches",
        "value": "\\.\\./"
      },
      {
        "fact": "layer1_rule_id",
        "op": "equals",
        "value": "L1-PATH-TRAVERSAL-001"
      }
    ]
  },
  "finding": {
    "message": "Potential path traversal at '{{token}}' in {{file}} at line {{line}}.",
    "primary_anchor": "token",
    "related": []
  },
  "mappings": {
    "owasp": [
      "A01"
    ],
    "soc2": [
      "CC6.1"
    ]
  },
  "references": [
    "Canonicalize paths using realpath()/resolve() and verify the result is within an allowed base directory.",
    "Maintain an explicit allowlist of accessible filenames or directories.",
    "Never use user input directly as a file path; use an indirection layer (e.g., file ID \u2192 path mapping).",
    "OWASP Path Traversal testing guide.",
    "CWE references: CWE-22, CWE-23, CWE-35"
  ]
}
