{
  "id": "owasp.auth.a07_jwt_none",
  "title": "JWT 'alg:none' Vulnerability",
  "description": "Accepting JWTs with 'alg: none' or verifying without algorithm enforcement allows attackers to forge tokens and bypass authentication (OWASP A07:2021 / CVE-2015-9235 class).",
  "policy": {
    "framework": "owasp",
    "category": "auth",
    "code": "a07_jwt_none"
  },
  "severity": "critical",
  "languages": [
    "*"
  ],
  "tags": [
    "jwt",
    "authentication",
    "owasp-a07"
  ],
  "scope": {
    "node_kinds": [
      "function_call",
      "string_literal"
    ]
  },
  "match": {
    "any": [
      {
        "fact": "token",
        "op": "matches",
        "value": "(?i)(algorithms\\s*=\\s*\\[\\s*['\"]none['\"]|alg\\s*:\\s*['\"]none['\"]|verify\\s*=\\s*False.*jwt|jwt.*verify\\s*=\\s*False)"
      },
      {
        "fact": "token",
        "op": "matches",
        "value": "(?i)(jwt\\.decode.*options.*verify_signature.*False|jwt\\.verify.*ignoreExpiration|jwt\\.decode.*complete.*True.*none)"
      },
      {
        "fact": "token",
        "op": "matches",
        "value": "(?i)\"alg\"\\s*:\\s*\"none\""
      },
      {
        "fact": "layer1_rule_id",
        "op": "equals",
        "value": "L1-JWT-NONE-001"
      }
    ]
  },
  "finding": {
    "message": "JWT 'alg:none' or signature verification disabled at '{{token}}' in {{file}} at line {{line}}.",
    "primary_anchor": "token",
    "related": []
  },
  "mappings": {
    "owasp": [
      "A07"
    ],
    "soc2": [
      "CC6.1"
    ]
  },
  "references": [
    "Always specify a strict list of allowed algorithms when decoding JWTs; never include 'none'.",
    "Use asymmetric signing (RS256/ES256) for JWTs in multi-service architectures.",
    "Validate issuer (iss), audience (aud), and expiry (exp) claims on every decode.",
    "OWASP JWT Security Cheat Sheet.",
    "CWE references: CWE-347"
  ]
}
